{
  "benchmark_result_id": "bench_0001",
  "dataset_id": "dataset_0001",
  "segment_id": "segment_0001",
  "noise_id": "noise_0001",
  "noise_type": "baseline_wander",
  "noise_severity": "moderate",
  "method_id": "method_0001",
  "method_family": "wavelet",
  "feature_ids": [
    "feature_qrs_shape"
  ],
  "metric_ids": [
    "metric_waveform_similarity"
  ],
  "morphology_feature_families": [
    "qrs_complex_shape",
    "r_peak_location"
  ],
  "metric_families": [
    "waveform_similarity",
    "peak_alignment"
  ],
  "result_summary": "Synthetic benchmark result demonstrating morphology-preservation evaluation structure.",
  "uncertainty_note": "Synthetic example only. No clinical interpretation.",
  "created_at": "2026-06-24T00:00:00Z",
  "review_status": "reviewed",
  "claim_boundary": "Benchmark structure defined; no superiority or clinical claims supported.",
  "public_safety_boundary": "synthetic",
  "ml_readiness": "schema_ready"
}
